quote_text,speaker,chapter,book,code
"""The opening music begins. Its easy to hear, blasted around the Capitol. Massive doors slide open revealing the crowd-lined streets. The ride lasts about twenty minutes and ends up at the City Circle, where they will welcome us, play the anthem, and escort us into the Training Center, which will be our home/prison until the Games begin.""",Katniss,5,The Hunger Games,Cultural
"""Presenting ourselves not as adversaries but as friends has distinguished us as much as the fiery costumes.""",Katniss,6,The Hunger Games,Proairetic
"""Barbarism? Thats ironic coming from a woman helping to prepare us for slaughter. And whats she basing our success on? Our table manners?""",Katniss,6,The Hunger Games,Hermeneutic
"""But I do know her. And now that Haymitch has mentioned the word traitor I remember from where. The disapproval is so high I could never admit it.""",Katniss,6,The Hunger Games,Semic
"""Someone who committed a crime. They cut her tongue so she cant speak. Shes probably a traitor of some sort. Not likely youd know her.""",Haymitch,6,The Hunger Games,Semic
"""She has reminded me why Im here. Not to model flashy costumes and eat delicacies. But to die a bloody death while the crowds urge on my killer.""",Katniss,6,The Hunger Games,Symbolic
"""The only time you can count on it is when theyre airing the Games or some important government message on television that its mandatory to watch.""",Katniss,6,The Hunger Games,Cultural
"""You do have the sense that we might be under surveillance here.""",Katniss,6,The Hunger Games,Symbolic
"""Haymitch had called the Avoxes traitors. Against what? It could only be the Capitol. But they had everything here. No cause to rebel.""",Katniss,6,The Hunger Games,Cultural
"""That I let the Capitol kill the boy and mutilate her without lifting a finger. Just like I was watching the Games.""",Katniss,6,The Hunger Games,Cultural
"""Suddenly I am furious, that with my life on the line, they dont even have the decency to pay attention to me.""",Katniss,7,The Hunger Games,Semic
"""Without thinking, I pull an arrow from my quiver and send it straight at the Gamemakers table. I hear shouts of alarm as people stumble back. The arrow skewers the apple in the pigs mouth and pins it to the wall behind it. Everyone stares at me in disbelief. Thank you for your consideration, I say. Then I give a slight bow and walk straight toward the exit without being dismissed.""",Katniss,7,The Hunger Games,Symbolic
"""What will they do to me now? Arrest me? Execute me? Cut my tongue and turn me into an Avox so I can wait on the future tributes of Panem? What was I thinking, shooting at the Gamemakers? Of course, I wasnt, I was shooting at that apple because I was so angry at being ignored.""",Katniss,8,The Hunger Games,Cultural
"""I shot an arrow at the Gamemakers.""",Katniss,8,The Hunger Games,Not applicable
"""I shot an arrow at them. Not exactly at them. In their direction. Its like Peeta said, I was shooting and they were ignoring me and I just . . . I just lost my head, so I shot an apple out of their stupid roast pigs mouth!""",Katniss,8,The Hunger Games,Not applicable
"""What about my family? Will they punish them?""",Katniss,8,The Hunger Games,Hermeneutic
"""Having watched the tribute interviews all my life, I know theres truth to what hes saying. If you appeal to the crowd, either by being humorous or brutal or eccentric, you gain favor.""",Katniss,8,The Hunger Games,Cultural
"""All I can think is how unjust the whole thing is, the Hunger Games. Why am I hopping around like some trained dog trying to please people I hate?""",Katniss,8,The Hunger Games,Cultural
"""Im very hard to catch, And if they cant catch me, they cant kill me. So dont count me out.""",Rue,9,The Hunger Games,Not applicable
"""He made you look desirable! And lets face it, you can use all the help you can get in that department. You were about as romantic as dirt until he said he wanted you. Now they all do. Youre all theyre talking about. The star-crossed lovers from District Twelve!""",Haymitch,10,The Hunger Games,Cultural
"""Stay alive.""",Haymitch,10,The Hunger Games,Symbolic
"""I dont know how to say it exactly. Only . . . I want to die as myself. Does that make any sense? I dont want them to change me in there. Turn me into some kind of monster that Im not.""",Peeta,10,The Hunger Games,Hermeneutic
"""No, when the time comes, Im sure Ill kill just like everybody else. I cant go down without a fight. Only I keep wishing I could think of a way to . . . to show the Capitol they dont own me. That Im more than just a piece in their Games,""",Peeta,10,The Hunger Games,Cultural
"""There was a guy like that a few years ago from District 6 called Titus. He went completely savage and the Gamemakers had to have him stunned with electric guns to collect the bodies of the players hed killed before he ate them. There are no rules in the arena, but cannibalism doesnt play well with the Capitol audience, so they tried to head it off. There was some speculation that the avalanche that finally took Titus out was specifically engineered to ensure the victor was not a lunatic.""",Katniss,10,The Hunger Games,Cultural
"""I dont particularly like this. Valleys make me feel trapped. I want to be high, like in the hills around District 12, where I can see my enemies approaching. But I have no choice but to keep going.""",Katniss,11,The Hunger Games,Cultural
"""I wonder if the Gamemakers are blocking out our conversation, because even though the information seems harmless, they don't want people in different districts to know about one another.""",Katniss,15,The Hunger Games,Cultural
"""I can almost hear Haymitch groaning as I team up with this wispy child. But I want her. Because shes a survivor, and I trust her, and why not admit it? She reminds me of Prim.""",Katniss,15,The Hunger Games,Hermeneutic
"""Maybe being the least prestigious, poorest, most ridiculed district in the country has its advantages. Such as, being largely ignored by the Capitol as long as we produce our coal quotas.""",Katniss,15,The Hunger Games,Cultural
"""That the Careers have been better fed growing up is actually to their disadvantage, because they dont know how to be hungry. Not the way Rue and I do.""",Katniss,16,The Hunger Games,Semic
"""For whatever reason, this is a first. A district gift to a tribute who's not your own.""",Katniss,18,The Hunger Games,Cultural
"""I cant stop looking at Rue, smaller than ever, a baby animal curled up in a nest of netting. I cant bring myself to leave her like this. Past harm, but seeming utterly defenseless. To hate the boy from District 1, who also appears so vulnerable in death, seems inadequate. Its the Capitol I hate, for doing this to all of us.""",Katniss,18,The Hunger Games,Cultural
"""His ravings against the Capitol no longer pointless, no longer to be ignored. Rues death has forced me to confront my own fury against the cruelty, the injustice they inflict upon us. But here, even more strongly than at home, I feel my impotence. Theres no way to take revenge on the Capitol. Is there?""",Katniss,18,The Hunger Games,Cultural
"""I want to do something, right here, right now, to shame them, to make them accountable, to show the Capitol that whatever they do or force us to do there is a part of every tribute they cant own. That Rue was more than a piece in their Games. And so am I.""",Katniss,18,The Hunger Games,Cultural
"""Without emotion or the slightest tremor in my hands. My hatred of the Capitol has not lessened my hatred of my competitors in the least. Especially the Careers. They, at least, can be made to pay for Rues death.""",Katniss,18,The Hunger Games,Cultural
"""Just this one time, I let you go. For the little girl. You and me, were even then. No more owed. You understand?""",Thresh,21,The Hunger Games,Hermeneutic
"""Haymitch is our only hope, but nothing is forthcoming, either from lack of money  everything will cost an exorbitant amount  or because hes dissatisfied with our performance. Probably the latter. Id be the first to admit were not exactly riveting today.""",Katniss,22,The Hunger Games,Symbolic
"""And I do. No viewer could turn away from the show now. From the Gamemakers point of view, this is the final word in entertainment.""",Katniss,25,The Hunger Games,Proairetic
"""Yes, they have to have a victor. Without a victor, the whole thing would blow up in the Gamemakers faces. Theyd have failed the Capitol. Might possibly even be executed, slowly and painfully while the cameras broadcast it to every screen in the country.""",Katniss,25,The Hunger Games,Cultural
"""Everything is about them, not the dying boys and girls in the arena.""",Katniss,26,The Hunger Games,Cultural
"""Listen up. Youre in trouble. Word is the Capitols furious about you showing them up in the arena. The one thing they cant stand is being laughed at and theyre the joke of Panem""",Haymitch,26,The Hunger Games,Cultural
"""Your only defense can be you were so madly in love you werent responsible for your actions.""",Haymitch,26,The Hunger Games,Semic
"""But if what Haymitch says is true, and hes got no reason to lie, Ive never been in such a dangerous place in my life.""",Katniss,26,The Hunger Games,Not applicable
"""But the Hunger Games are their weapon and you are not supposed to be able to defeat it. So now the Capitol will act as if theyve been in control the whole time. As if they orchestrated the whole event, right down to the double suicide. But that will only work if I play along with them.""",Katniss,26,The Hunger Games,Cultural
"""But I do notice they omit the part where I covered her in flowers.

  Right. Because even that smacks of rebellion.""",Katniss,27,The Hunger Games,Not applicable
"""Thats when I know that even though both of us would have eaten the berries, I am to blame for having the idea. Im the instigator. Im the one to be punished.""",Katniss,27,The Hunger Games,Semic
"""I suspect Haymitch initially, but then theres a more insidious fear that the Capitol may be monitoring and confining me. Ive been unable to escape since the Hunger Games began, but this feels different, much more personal. This feels like Ive been imprisoned for a crime and Im awaiting sentencing""",Katniss,27,The Hunger Games,Cultural
"""Its the Capitols way of reminding people that the Hunger Games never really go away. Well be given a lot of useless plaques, and everyone will have to pretend they love us.""",Katniss,27,The Hunger Games,Cultural
